698808669,02/06/2025 9:14 AM,No,No,No,No,No,No,No,No,No,No,Yes,No,66+,"$50,001 - $100,000",The concert was great but there could be a couple improvements to the facility. #1 It was very cold in there last night.  Even one of the guitarists commented on being cold. Can we please have more heat.  #2 Please find a way to do something about the lighting so that is does not glare off the instruments and blind the audience.,Please ask the audience to be respectful of other patrons.  #1 Please no photos or videos. When someone lifts up their phone it is very distracting to those in the audience who are behind them.  #2 Please ask people to take off their hats. It is VERY IMPOLITE to wear a cowboy/adventure hat while sitting in the audience. My view was blocked last night by the hat on the person in front of me.,,,International Guitar Night XXV,2/5/2025,,
698831373,02/06/2025 9:45 AM,Yes,No,No,No,No,No,No,No,No,No,Yes,No,66+,"$200,001 or above",first rate...as usual,,,,International Guitar Night XXV,2/5/2025,,
698841218,02/06/2025 10:02 AM,Yes,No,No,No,No,No,No,No,No,No,No,No,66+,"$50,001 - $100,000",Outstanding,,,,International Guitar Night XXV,2/5/2025,,
698854125,02/06/2025 10:21 AM,No,No,No,No,No,No,No,No,Yes,No,Yes,No,66+,"$200,001 or above",Incredible,More shows,,,International Guitar Night XXV,2/5/2025,,
698864597,02/06/2025 10:41 AM,No,No,No,No,No,No,No,No,No,No,Yes,No,66+,"$50,001 - $100,000",,"Sadly, I was unable to attend due to slippery roads.  At 6:15 PM, I started out from home, but in two blocks nearly skidded through the intersection.  Thinking it would get much colder and hazardous, I turned around and came home.",,,International Guitar Night XXV,2/5/2025,,
698866673,02/06/2025 10:45 AM,No,No,No,No,No,No,No,No,No,No,Yes,No,66+,"$50,001 - $100,000","I very much enjoyed it!  I attended the International Guitar Festival at the Powerhouse in 2024 and loved it.  As long as you bring them to Walla Walla, I will be there.",,,,International Guitar Night XXV,2/5/2025,,
698871351,02/06/2025 10:51 AM,No,No,No,No,No,No,No,No,No,Yes,No,No,56-65,"$50,001 - $100,000",I thought everything about last night's performance was excellent.  Please consider this tour event for next year.  I'll be there.,,,,International Guitar Night XXV,2/5/2025,,
698875845,02/06/2025 11:17 AM,No,No,No,No,No,No,No,Yes,Yes,No,No,No,56-65,"$50,000 or below","Stage lighting was great for this type of performance - good visibility of performers and instruments and not distracting.  The audio quality (from my seat anyway) was excellent- well-balanced (re: bass, mids and treble) and tones were rich and warm sounding yet clear and never muddy.   volume levels were very comfortable and allowed for all the subtle nuance and dynamics to come through too.     The temperature of lobby and theater area were comfortable, restroom clean and well-stocked.",,,,International Guitar Night XXV,2/5/2025,,
698899132,02/06/2025 11:40 AM,No,No,Yes,No,No,No,No,No,No,No,No,No,66+,"$50,000 or below",Always excellent. I truly hope you bring this event back again. It would be nice if you made a recording of this event for sale.,,,,International Guitar Night XXV,2/5/2025,,
698972048,02/06/2025 1:39 PM,No,No,No,No,No,No,No,No,Yes,No,No,No,66+,,Wonderful!  Please keep bringing International Guitar Night - it's a fantastic opportunity!,,,,International Guitar Night XXV,2/5/2025,,
699002867,02/06/2025 2:34 PM,No,No,No,No,No,No,No,No,Yes,No,No,No,66+,,Wonderful event on all fronts. Enjoyed +Power Club pre-event. Wild Thyme food was very tasty and great variety.,,,,International Guitar Night XXV,2/5/2025,,
699011028,02/06/2025 2:49 PM,No,No,No,No,No,No,Yes,No,No,No,No,No,66+,"$50,001 - $100,000",All great.,,,,International Guitar Night XXV,2/5/2025,,
699035748,02/06/2025 3:36 PM,No,No,No,No,No,No,No,No,Yes,No,No,No,66+,"$100,001 - $200,000",great event!   Need to have more like this one.,,,,International Guitar Night XXV,2/5/2025,,
699070891,02/06/2025 4:50 PM,No,No,No,No,No,No,No,Yes,No,Yes,No,No,36-45,"$100,001 - $200,000","Absolutely fantastic.  We are going to keep trying out different seats since it can be hard to see around heads, parts of the railing, etc.","Would have loved to have more information about the pieces and the musicians in print format.  I know this particular tour does not lend itself to that much, though.",,,International Guitar Night XXV,2/5/2025,,
699126133,02/06/2025 6:44 PM,No,No,No,No,No,No,No,No,No,No,No,Yes,56-65,"$100,001 - $200,000","Good stuff, loved the movies",Needed a bar upstairs,,,February Film Feast,2/1/2025,,
699134205,02/06/2025 7:04 PM,No,No,No,No,No,No,No,No,Yes,No,No,No,66+,"$100,001 - $200,000",Love the theater! Found about the International Guitar Night last year reading the Tumbleweird while waiting for work our car at the Pasco Les Schwab. We are now on the mailing list; I responded quickly enough to get front row seats for the 2/5/25 show and absolutely loved the intimacy of being that close to the performers.,,,,International Guitar Night XXV,2/5/2025,,
699386173,02/07/2025 8:12 AM,No,No,No,No,No,No,No,No,No,No,Yes,No,66+,,Excellent event. Have attended the international guitar concert thrice and hope it returns every year.,Happy you are here. Great venue. Great performance.,,,International Guitar Night XXV,2/5/2025,,
699410585,02/07/2025 8:55 AM,No,No,No,No,No,No,No,No,No,No,Yes,No,56-65,,"Loved the International Guitar Night.  I thought the sound level was quite nice, not too loud.  As I recall from last year, I thought the 4 artists were more diverse in their guitar genres.  This year seemed like they all played in the classic style.  Would have like to have seen more diversity in the music.  ",Really appreciate having this level of entertainment in our small town of WW!!  Thank you.,,,International Guitar Night XXV,2/5/2025,,
700074190,02/08/2025 12:15 PM,No,No,Yes,No,No,No,No,No,No,No,No,No,66+,"$50,000 or below",Extraordinary in every way! First time in that theater and I'll definitely return for a program such as this.,,,,International Guitar Night XXV,2/5/2025,,
700316797,02/08/2025 9:35 PM,No,No,No,No,No,No,No,No,Yes,No,No,No,66+,"$50,000 or below",Fantastic!!,,,,International Guitar Night XXV,2/5/2025,,
701040078,02/10/2025 8:19 AM,No,No,No,No,No,No,No,No,Yes,No,No,No,66+,"$100,001 - $200,000","Good quality production, sound just right, and good price.  A bit steep for $7 non-alcoholic beverages.  I didn't ask what they were but went without as I didn't want to cough up $7 for a bottle of water or soda.",,,,Macbeth: David Tennant ,2/9/2025,,
701123309,02/10/2025 10:44 AM,No,No,No,No,No,No,No,No,No,Yes,No,No,36-45,"$100,001 - $200,000",Delightful!,,,,Macbeth: David Tennant ,2/9/2025,,
701139347,02/10/2025 11:11 AM,No,No,No,No,No,No,No,No,No,No,Yes,No,25 and under,"$50,000 or below","I loved the old school look of the theatre. The employees were wonderful and treated my friend and I so well. I could hear well, the seats were good, just overall good experience! 5/5 stars!!",,,,Macbeth: David Tennant ,2/9/2025,,
702173576,02/12/2025 7:08 AM,No,No,No,No,No,No,No,No,Yes,No,No,No,36-45,"$100,001 - $200,000","Great! It was beautiful, easy to hear and see, comfortable, no distractions!",The front staff were so friendly and kind! Thanks for a nice afternoon. ,,,Macbeth: David Tennant ,2/9/2025,,
702805701,02/13/2025 8:47 AM,No,No,No,No,No,No,No,No,No,Yes,No,No,26-35,"$50,000 or below","Loved the documentary! No issue with sound, lighting etc. fair price too. Staff was kind. ",I wish that there were more people in attendance. Not sure how marketing could have been better to attract a wider audience but I also understand it was a very niche film so not many would choose to attend. ,,,Power House Movies: Ultimate Citizens,2/12/2025,,
702859809,02/13/2025 10:22 AM,No,No,No,No,No,No,No,No,No,No,Yes,No,56-65,"$50,001 - $100,000","Inspiring. Compassionate message.
Quality, lighting, sound all good!
Wish more people would have come...",Thanks for the opportunity. ,,,Power House Movies: Ultimate Citizens,2/12/2025,,
702973963,02/13/2025 1:49 PM,No,No,No,No,No,No,No,No,Yes,No,No,No,56-65,"$100,001 - $200,000",Perfect,,,,Power House Movies: Ultimate Citizens,2/12/2025,,
703974498,02/15/2025 8:19 AM,No,No,No,No,No,No,No,Yes,No,No,No,No,46-55,"$200,001 or above","Everything was perfect, no complaints about the venue. Had one super annoying, rude guest in audience. I'm not sure if he was asked to leave or if he left by choice, but the show was much more enjoyable with him gone. ",,,,Jen Kober,2/14/2025,,
703976658,02/15/2025 8:27 AM,No,No,No,No,No,No,No,No,Yes,No,Yes,No,46-55,"$50,001 - $100,000","Fabulous!!! That was one of the best comedy shows I have seen, and I have paid $80 to see a few comics. It was EXACTLY what I needed. I really appreciate your commitment to diversity by bringing a liberal lesbian comic to W2 on Valentine’s Day. It was amazing! I knn my ow the turnout was disappointing, but please don’t let that discourage you. This is exactly what many of us who attended needed. Thank you!!!!",Suggest talking with Jeremy Mendenhall of Walla Walla Pride to advertise shows with LGBTQ+ content such as Scout Durwoods upcoming shows (can’t wait). I think his newsletter and Facebook postings could help draw in a larger crowd. Might also try the diversity offices at Whitman and WWCC. WallaWallaPride@gmail.com,,,Jen Kober,2/14/2025,,
703981844,02/15/2025 8:32 AM,No,No,No,No,No,No,No,Yes,No,No,Yes,No,56-65,"$50,001 - $100,000",It was a great show! We are big people. I wish the seats were larger ,Please bring more like her! ,,,Jen Kober,2/14/2025,,
703990858,02/15/2025 8:45 AM,No,No,No,No,No,No,No,No,Yes,No,Yes,No,56-65,"$100,001 - $200,000",We were not able to attend due to a family emergency. ,,,,Jen Kober,2/14/2025,,
703995754,02/15/2025 8:54 AM,No,No,No,No,No,No,No,No,No,No,No,Yes,56-65,"$100,001 - $200,000","Jen K. Was very funny, engaged with the audience.",I have been several times and the show never starts on time. Last night they started about 12-15 minutes late which is not bad. In the past they have started over 30 minutes late.,,,Jen Kober,2/14/2025,,
703996151,02/15/2025 8:54 AM,No,No,No,No,No,No,No,Yes,No,No,No,No,46-55,"$100,001 - $200,000",It was great. There was a man being belligerent and we appreciate the fact he left or was escorted out.,,,,Jen Kober,2/14/2025,,
704180987,02/15/2025 1:49 PM,No,No,No,No,No,No,No,No,Yes,No,No,No,36-45,,"All was great, we really enjoyed the show! ",,,,Jen Kober,2/14/2025,,
708309799,02/22/2025 8:22 AM,No,No,No,No,No,No,No,Yes,No,No,Yes,No,46-55,"$200,001 or above","The event was perfect, but not well attended enough for how good it was. ","I think powerhouse needs to do a better job advertising the events as they are. Last years Mike Wiley play was equallly unattended. I think if the theatre did a better job promoting it as fun, interactive, and very moving, more people would have bought tickets. In walla walla, you cannot just put a picture of a Black man on a poster and think this population will be interested. They need to know that it will be fun and not just a “scary learning experience.” We are almost there, but still need help encouraging folks. I do hope he comes back next year, because our community deserves the experience. I, for sure, will be buying tickets. ",,,Jackie Robinson: A Game Apart,2/21/2025,,
708322085,02/22/2025 8:43 AM,No,No,No,No,No,No,No,No,Yes,No,No,No,66+,"$100,001 - $200,000","Everything was fine except for the heating problem you are working on. Please get it done. My wife and I were cold during the performance despite the fact that we had coats on.
Mike Wiley was excellent: fun, funny, and dramatically informative. Bring him back. He certainly knows how to engage an audience !! And he is teaching Black History to boot.",,,,Jackie Robinson: A Game Apart,2/21/2025,,
708329183,02/22/2025 8:49 AM,No,No,No,No,No,No,No,Yes,Yes,No,No,No,56-65,"$100,001 - $200,000",It was very good ,We would love more one person theater experiences ,,,Jackie Robinson: A Game Apart,2/21/2025,,
708368207,02/22/2025 9:54 AM,Yes,No,No,No,No,No,No,No,No,No,No,No,66+,"$100,001 - $200,000",Excellent! We had a wonderful time! The venue is an exceptionally personal experience. Thank you.,We didn’t notice the heating issue. Thank you for the heads up about the parts problem. You should be proud of what you’ve accomplished.,,,Jackie Robinson: A Game Apart,2/21/2025,,
708441366,02/22/2025 11:28 AM,No,No,No,No,No,No,No,No,No,No,No,Yes,46-55,"$100,001 - $200,000",It was so awesome and intimate! The play was so engaging and such a fabulous learning lesson.,,,,Jackie Robinson: A Game Apart,2/21/2025,,
708608291,02/22/2025 3:38 PM,No,No,No,No,No,No,No,No,Yes,No,No,No,56-65,"$100,001 - $200,000",Fantastic,,,,Jackie Robinson: A Game Apart,2/21/2025,,
711465171,02/27/2025 10:23 AM,No,No,No,No,No,No,No,No,Yes,No,No,No,26-35,"$100,001 - $200,000",great event!,,,,My Own Normal,2/26/2025,,
712319815,02/28/2025 6:49 PM,Yes,No,No,No,No,No,No,No,Yes,No,No,No,66+,,"Not sure that it's avoidable, but the spotlight at times reflected right off the instruments and into members of the audience's eyes.  In spite of that little distraction, the experience was incredible.  Have been to a couple of these before, and they are always delightful.  The whole synergy of bringing nations together--and particularly, during this tumultuous political moment--makes it even more poignant than ever to continue encouraging the unification of all people through music.  Excellent musicians all!","My husband claims that live acts are his preference such as musical groups; although, he doesn't really care for the comedy acts.  I like all the variety the Theatre has to offer.  While I explain to him that many of the films shown at the Gesa Theatre are very unique and oftentimes not available for viewing elsewhere, he says that he won't go to a film.  I enjoy them immensely.  Thanks for soliciting feedback from your spectators.  Appreciate the inclusion and the opportunity to participate in that way.",,,International Guitar Night XXV,2/5/2025,,
712856767,03/01/2025 6:39 PM,No,No,No,No,No,No,No,No,No,No,Yes,No,46-55,"$200,001 or above",It was good. We were in the front row. It felt like a very intimate experience.,,,,Jen Kober,2/14/2025,,
713738505,03/03/2025 10:07 AM,No,No,No,No,No,No,No,No,No,No,Yes,No,26-35,"$100,001 - $200,000",Really enjoyed it.,,,,Big Bang Boom,3/2/2025,,
713789982,03/03/2025 11:23 AM,Yes,No,No,No,No,No,No,No,No,No,No,No,66+,,Loved the show !,,,,Big Bang Boom,3/2/2025,,
713868052,03/03/2025 1:37 PM,Yes,No,No,No,No,No,No,No,No,No,No,No,66+,"$50,000 or below",A great first live show for my 5 year old granddaughter!,I wish there would have been a place for the kids to dance together. ,,,Big Bang Boom,3/2/2025,,
367004500,03/23/2023 9:17 PM,No,No,,No,,No,No,Yes,Yes,Yes,No,No,66+,"$50,001 - $100,000",Delightful!  We enjoyed the woodwind quintet’s version of Peter and the Wolf very much.,,PeterandtheWolf,No,,,,
367010344,03/23/2023 9:43 PM,No,No,,No,,No,No,No,No,No,Yes,No,36-45,"$50,001 - $100,000","Excellent 
Wonderful 
Very good",,PeterandtheWolf,No,,,,
367291687,03/24/2023 2:02 PM,Yes,No,,No,,No,No,No,No,No,No,No,66+,"$50,001 - $100,000",Great,,PeterandtheWolf,No,,,,
367586520,03/25/2023 8:22 AM,No,No,,No,,No,No,No,No,Yes,No,No,46-55,"$50,001 - $100,000","It was a wonderful family event, the quality was amazing- lighting and sound were perfect!",,PeterandtheWolf,No,,,,
369920894,03/30/2023 9:22 AM,No,No,,No,,No,No,No,Yes,No,No,No,66+,"$50,000 or below",It was fabulous!  the performers were incredible and all aspects of the theatre were excellent.  i just wished more people had been in attendance.  Maybe putting posters up at the elementary schools?  I also went the next night with same results,,PeterandtheWolf,No,,,,
489745158,02/21/2024 9:54 PM,No,No,No,No,No,No,Yes,No,No,No,No,No,66+,"$50,001 - $100,000","Excellent! 
Friendly staff, easy ticket process, comfortable seats, good acoustics, temperature just right, emailed info was really helpful in setting expectations and helping us plan. Knowing ahead of time it was 90 minutes without intermission made it possible to take care of bathroom needs without interruptions.","Holy Frit was so well done. I wish it could have been offered more than just one time. My partner was unavailable tonight. He would have loved this! 
   I don’t drink alcohol. I don’t want sugary beverages. I wish it would have been possible to bring water with me (since food and beverages were allowed in the theater.) I have kidney issues and am supposed to stay well hydrated. If bottled water was sold in the lobby, I missed it. 
    Gesa is such a great organization with wonderful volunteers. 
    We appreciate what you offer the community. 
   Keep up the good work.",HolyFrit,,,,,
489745507,02/21/2024 9:51 PM,No,No,No,No,No,No,No,No,No,No,Yes,No,46-55,,"Loved the event and space!  
Space needs absorption for sound; lots of hard surfaces …..
Maybe consider hospitality after the show for additional fundraising…. 
Great value, lovely people welcoming us in….",,HolyFrit,,,,,
489748305,02/21/2024 10:04 PM,No,No,No,No,No,No,No,No,No,Yes,No,No,66+,"$50,001 - $100,000","Sound quality
Projection wuality",,HolyFrit,,,,,
489750656,02/21/2024 10:19 PM,No,No,No,No,No,No,No,No,Yes,No,No,No,56-65,"$100,001 - $200,000",Good ,Excellent choice of movie! Well worth the 2 hour round trip,HolyFrit,,,,,
489751211,02/21/2024 10:23 PM,No,No,No,No,No,No,No,No,No,Yes,No,Yes,66+,"$100,001 - $200,000",The space was great. I wish the screen was further back on the stage.,Put the screen further back on the stage.,HolyFrit,,,,,
489753097,02/21/2024 10:37 PM,Yes,No,Yes,No,No,No,No,No,No,No,No,No,66+,"$50,000 or below","Venue, picture quality, and sound were great.  Staff were helpful & friendly.  Wine was excellent.",,HolyFrit,,,,,
489840813,02/22/2024 6:49 AM,No,No,No,No,No,No,No,No,No,No,Yes,No,56-65,,High marks overall.,We always like our visits to the Power House.,HolyFrit,,,,,
489861869,02/22/2024 7:41 AM,No,No,No,No,No,No,No,No,No,Yes,No,No,66+,"$50,001 - $100,000",It was great!,,HolyFrit,,,,,
489865936,02/22/2024 7:50 AM,Yes,No,No,No,No,No,No,No,No,No,No,No,66+,"$50,000 or below",ALL GOOD,ENJOYED THE WHOLE EXPERIENCE ,HolyFrit,,,,,
489878123,02/22/2024 8:20 AM,Yes,No,No,No,No,No,No,No,Yes,No,Yes,No,66+,"$50,001 - $100,000","“Holy Frit” was a beautiful and interesting movie. PHT is a perfect venue for unusual , informative film such as this. It is intimate, comfortable seating and great sound (not too loud!). Thank you for bringing it to WW. Great experience, good value. ",,HolyFrit,,,,,
490028800,02/22/2024 1:49 PM,No,No,No,No,No,No,No,No,Yes,No,No,No,56-65,"$50,001 - $100,000",10/10 for all the above.,Love the documentary films you are showing. ,HolyFrit,,,,,
490181889,02/22/2024 9:27 PM,No,No,No,No,No,No,No,No,Yes,No,No,No,66+,"$100,001 - $200,000","Excellent selection of an interesting movie, well produced.  Both sound quality and projection quality were good.  Movies like this are of high value to the community in that they are unlikely to appear in for profit cinemas that need to screen a show multiple times.  ","I would like to see more movies at Gesa.  It’s a good venue for “arty” or even foreign films.  However, those films require a first class marketing program which I don’t think Gesa has yet managed to accomplish.  Looking at the list of where we might hear of these films, there doesn’t seem to be any outlet targeting college students at Whitman or Whitman’s arts/drama/music departments.  There are documentaries  (such as “giants Rising”) that would be of interest to younger people if the marketing informs them effectively and in advance.  At the screening, there were movies previewed that I was unaware of (not in the Gesa brochure that was handed out).  There has been Quest classes on movies but I don’t think those potential audiences have been targeted.  
I would also be interested in seeing Gesa explore subscribing to NTLive programming.  That might be a partnership with the colleges/university offering a student discount price.  Please look into NTLive (National Theater of London productions that are filmed on the final night of performances that are at times better than the actual show — I saw a live performance and later the NTLive film of the live production: the camera angles gave much better reading of the actors than seeing it live.). I highly recommend nearly all of their productions.  ",HolyFrit,,,,,
490200551,02/22/2024 11:22 PM,Yes,No,No,No,No,No,No,No,No,No,No,No,66+,"$50,000 or below",very good,,HolyFrit,,,,,
494778196,03/04/2024 8:26 PM,Yes,No,No,No,No,No,No,No,Yes,No,No,No,66+,,"Loved this film--and the title was on point:  Holy Frit! indeed.  It encompassed captivating images; sound was just right; value was increased by the education which I feel I received watching the process of how to create stained/fused glass.  Such a journey for the artist, the production crews--glass makers, installers and camera manipulators, plus the courage it took to take on such an enormous endeavor.  The gigantic risks taken and the expenses incurred--constantly having to evolve was a great lesson for us all.","This was one of the most memorable films I've seen at the Powerhouse.  Full of fun, humor, challenge, beauty, collaboration, glass artistry and more--with the ultimate result.  This film hooked me on researching the largest commissioned stained-glass project in the world (at the time) because it made me want to know more.  What an incredible feat to have considered, accepted and produced.  When I saw the eyes of Jesus (I'm not particularly religious.), it touched me in a deeply spiritual way from an artistic perspective.",HolyFrit,,,,,
491910269,02/26/2024 7:32 PM,No,No,No,No,No,No,No,No,No,No,Yes,No,56-65,"$100,001 - $200,000",Liked the food. Loved the movies.,,FebruaryFilmFeast,,,,,
491912248,02/26/2024 7:46 PM,No,No,No,No,No,No,No,No,No,Yes,No,No,56-65,"$100,001 - $200,000","Films were fun. Food good. What was with the high charges for small
Wine pours and very disappointing so much plastic waste on all the small bites. Felt wrong.  Tiny space even for a partially subscribed event. More people- as you should get- would have made this unbearable   No place to sit for two hours. No place to set a wine glass or plate. No free water. Great inaugural event. Will come back but consider the space limitations as it was a challenge. Also wish additional farmer/food producers were there. My comments are to help. Really so happy we went. Felt like a terrific adventure ",,FebruaryFilmFeast,,,,,
491917167,02/26/2024 8:00 PM,Yes,No,No,No,No,No,No,No,No,No,Yes,No,66+,"$100,001 - $200,000",Excellent.,"Pre-films food and drink time could have offered some seating, although I know it was crowded for space.",FebruaryFilmFeast,,,,,
492039636,02/27/2024 6:57 AM,No,No,No,No,No,No,No,Yes,No,No,No,No,56-65,"$200,001 or above","Fun event for the community who are foodies, shorts were fun and diverse.","Electric Lounge was just too small for this event. The ""Feast"" dynamic of the event was really not. I felt people thought of it as a dinner (5pm start?) and ate like they were eating for that. We did arrive 30 min after  5pm and there were no lamb meatballs, and things listed on the sheet. We were crammed in the corner of the room and stood holding a few bites before we had to fight our way to the food again.  Could you do a set up outside if you did the event later in the year, with tables? Could you offer tables downstairs? Could you do a ""feast"" of setting up table to seat 50 or so on the stage, bites served and cleared, dessert served upstairs in Electric Lounge and reset the theater for the shorts? $55 was pricey for the food we got.",FebruaryFilmFeast,,,,,
492058328,02/27/2024 7:40 AM,No,No,No,No,No,No,Yes,No,No,No,No,No,56-65,,"Really enjoyed the entire program, from the snacks from chef Chris to meeting a few local farmers and the multiple creative movie shorts.
We would go it again.",,FebruaryFilmFeast,,,,,
492316395,02/27/2024 5:39 PM,No,No,No,No,No,No,No,No,No,No,No,Yes,56-65,"$200,001 or above",I love the venue and it was  a great value for an interesting night.,,FebruaryFilmFeast,,,,,
492663756,02/28/2024 1:09 PM,No,No,No,No,No,No,No,No,Yes,No,Yes,No,66+,"$100,001 - $200,000",Food was outstanding; the films were fabulous.,,FebruaryFilmFeast,,,,,
487786016,02/17/2024 9:22 PM,No,No,No,No,No,No,No,No,No,No,No,Yes,36-45,"$100,001 - $200,000","The sound was a little echo-ey, but otherwise it was a beautiful theater and a wonderfully run event. Everyone was so friendly.",I enjoyed every minute ,CaesarSings,,,,,
487787280,02/17/2024 9:28 PM,No,No,No,No,No,No,No,No,No,No,Yes,No,66+,"$100,001 - $200,000",This was a fabulous show! So much talent and we hope that Caesar & Mark return to Gesa!,So happy that we saw the show. I'm going to order the CD next.,CaesarSings,,,,,
487788325,02/17/2024 9:32 PM,No,No,No,No,No,No,No,No,Yes,No,No,No,66+,"$50,001 - $100,000",,,CaesarSings,,,,,
487789355,02/17/2024 9:37 PM,No,No,No,No,No,No,No,No,No,No,Yes,No,66+,"$100,001 - $200,000",Great event ,,CaesarSings,,,,,
487791959,02/17/2024 9:49 PM,No,No,No,No,No,No,No,No,No,No,Yes,No,56-65,"$200,001 or above",Outstanding ,,CaesarSings,,,,,
487795347,02/17/2024 10:09 PM,No,No,No,No,No,No,No,No,No,No,Yes,No,66+,"$100,001 - $200,000",,,CaesarSings,,,,,
487798713,02/17/2024 10:27 PM,No,No,No,No,No,No,No,No,Yes,No,No,No,56-65,"$200,001 or above",I would have liked info on website about best seating for wheelchair or walker. Balcony with elevator was terrible for my MIL. ,Event was great. ,CaesarSings,,,,,
487801640,02/17/2024 10:43 PM,No,No,No,No,No,No,No,Yes,No,No,No,No,56-65,,"We had a wonderful time. Great music. We were tired and probably wouldn't have gone if we didn't already have tickets, but we are glad we did and felt a bit of a boost. ",,CaesarSings,,,,,
