477728705,01/27/2024 7:45 PM,No,No,No,No,No,No,No,No,No,No,Yes,No,46-55,"$50,001 - $100,000","Everything was great! The lighting and sound was perfect. A little tight standing room while waiting for the show to start, but once started it was fantastic! The staff is very friendly and accommodating, thank you!","If possible to make the waiting area larger before the show starts or allow patrons to go to their seats earlier, that would be a welcome addition!",MikeBirbiglia,,,,,
477966192,01/28/2024 2:09 PM,No,No,No,No,No,No,No,No,Yes,No,No,No,36-45,"$200,001 or above",Great! Intimate.,,MikeBirbiglia,,,,,
478435220,01/29/2024 2:06 PM,No,No,No,No,No,No,No,No,No,No,No,Yes,46-55,"$200,001 or above","Great location!  Even though show was running late and we stood in cold for 20 min waiting, staff was very pleasant ",,MikeBirbiglia,,,,,
478590808,01/29/2024 8:38 PM,No,No,No,No,No,No,No,No,Yes,No,Yes,No,36-45,"$100,001 - $200,000","We enjoyed every aspect of the show. The comedy was top-notch - we've never laughed so much - yet also thoughtful. The martinelli's we purchased was affordable and tasty, and the sound and lighting were smooth. Thank you for bringing Mike to Walla Walla.",,MikeBirbiglia,,,,,
478622858,01/29/2024 11:29 PM,No,No,No,No,No,No,No,No,Yes,No,No,No,46-55,"$100,001 - $200,000",Fabulous. Great venue for a comedy show.,,MikeBirbiglia,,,,,
478626057,01/30/2024 12:03 AM,No,No,No,No,No,No,No,Yes,Yes,No,No,No,26-35,"$100,001 - $200,000","We were very pleased with the intimacy of the venue, the quality of the sound, the lighting. The staff was very friendly and communicative. We drove over 4 hours to see the show (from Boise) and we were very happy with the event. ","The temperature control in the venue could have been a bit better (it got quite stuffy in there). Additionally, better signage regarding where to wait would have been helpful. We were there for the 9pm show on Wednesday and the show before ran later than anticipated. Once we were allowed in, it was a bit confusing on where to go. We were not purchasing refreshments/waiting in line and there was not a lot of direction as to where to hang out while the theater was reset or where the theater entrance even was. ",MikeBirbiglia,,,,,
479123034,01/31/2024 7:29 AM,No,No,No,No,No,No,No,No,No,Yes,No,No,56-65,,We had a wonderful time and Mike was very funny and entertaining.  We were just thrilled that he fit our little town into his tour.  Would love to see him again!,,MikeBirbiglia,,,,,
479393778,01/31/2024 6:54 PM,No,No,No,No,No,No,No,Yes,No,No,No,No,56-65,"$100,001 - $200,000","Excellent! We are from Ontario, Oregon. We were very impressed with the quality of the venue. I love when things can be repurposed - including buildings. And, it was a quick walk from the Marcus Whitman, where we were staying.",Great customer service is all about expectations being met or exceeded. We really appreciated your staff coming out and letting us know that the first show had run long and we had time to run to a convenience store to get cough drops and coffee. (I was fighting a cold.) ,MikeBirbiglia,,,,,
479839196,02/01/2024 8:58 PM,No,No,No,No,No,No,No,No,Yes,No,Yes,No,66+,,Great,,MikeBirbiglia,,,,,
481220125,02/04/2024 11:41 PM,No,No,No,No,No,No,No,Yes,Yes,No,No,No,36-45,"$100,001 - $200,000",,,MikeBirbiglia,,,,,
450762109,11/12/2023 4:13 PM,Yes,No,,No,No,No,No,No,No,No,Yes,No,56-65,"$100,001 - $200,000","Awesome! Witty, snappy and very entertaining.  I think the kids loved it.",,CircusScienceSpectacular,,,,,
450763500,11/12/2023 4:18 PM,No,No,,No,No,No,No,No,Yes,No,No,No,26-35,"$100,001 - $200,000","Great experience. Fun, exciting, educational! Would recommend. ",,CircusScienceSpectacular,,,,,
450785535,11/12/2023 5:28 PM,Yes,No,,No,No,No,No,No,No,No,No,No,66+,"$100,001 - $200,000",Good,,CircusScienceSpectacular,,,,,
450789381,11/12/2023 5:46 PM,No,No,,No,No,No,No,No,No,Yes,No,No,,,Good,"There was a photographer taking pictures of the audience. When it comes to taking pictures of children and posting them online, people should request permission first. Some people value their privacy and/or don't want to have pictures of their kids posted online. ",CircusScienceSpectacular,,,,,
450807150,11/12/2023 6:44 PM,No,No,,No,No,No,No,No,No,No,Yes,No,46-55,"$100,001 - $200,000",It was very nice. We enjoyed our time there a lot. Sound and lighting were both very good quality for those with a normal hearing range. ,My husband does not hear well - did you have any options to assist with that?  ,CircusScienceSpectacular,,,,,
450808092,11/12/2023 6:47 PM,No,No,,No,No,No,No,Yes,No,No,No,No,36-45,"$100,001 - $200,000",Great,,CircusScienceSpectacular,,,,,
450811312,11/12/2023 6:59 PM,Yes,No,,No,No,No,No,No,No,No,No,No,25 and under,"$200,001 or above",,,CircusScienceSpectacular,,,,,
450819885,11/12/2023 7:37 PM,Yes,No,,No,No,No,No,Yes,Yes,No,Yes,No,66+,"$100,001 - $200,000","One of the best programs for kids we have seen at the threater.  Kept the audience of all ages, including some younger littles, engaged and enjoying the show.  Moved well. We all enjoyed the show. ",,CircusScienceSpectacular,,,,,
450833125,11/12/2023 8:43 PM,No,No,,No,No,No,No,No,No,No,Yes,No,66+,"$50,000 or below","Good, overall impression, and the kids enjoyed it!","Can't think of anything at this time, but would be happy to contact you, if I think of anything...",CircusScienceSpectacular,,,,,
450835981,11/12/2023 9:01 PM,No,No,,No,No,No,No,No,No,No,Yes,No,66+,"$50,001 - $100,000","Good quality, lighting, sound and value. Educational and fun. About 15 minutes too long for my second grade grandson, ",It was a good experience and I hope there are many more family theater opportunities for kids. ,CircusScienceSpectacular,,,,,
450839331,11/12/2023 9:18 PM,No,No,,No,No,No,No,Yes,No,No,No,No,46-55,"$50,001 - $100,000",,,CircusScienceSpectacular,,,,,
450953109,11/13/2023 8:37 AM,No,No,,No,No,No,No,No,Yes,No,No,No,66+,,"It was a fun event, very entertaining. I attended with my 3 grandchildren, ages 6, 9 and 13. They all three had a great time and said they would love to go to another event like this one. ",,CircusScienceSpectacular,,,,,
450973417,11/13/2023 9:36 AM,No,No,,No,No,No,No,No,No,No,Yes,No,56-65,"$100,001 - $200,000","Fun, entertainment, and geared for both kids and adult humor. My 2 grandchildren age 7&10 enjoyed the show also. ",,CircusScienceSpectacular,,,,,
451057900,11/13/2023 12:41 PM,No,No,,No,No,No,No,No,No,No,Yes,No,56-65,,"Took my grands. Was fun. 
And finally something affordable. 
Most show are to expensive.","More kids stuff at a good value.
We are a very lower income for younger people. ",CircusScienceSpectacular,,,,,
442662913,10/18/2023 10:57 PM,No,No,,No,No,No,No,No,No,No,Yes,No,56-65,"$200,001 or above","Excellent sounds, lighting, and seating.  Overall an excellent value and a great experience.",,Exposure,,,,,
442853381,10/19/2023 12:31 PM,No,No,,No,No,No,No,No,Yes,No,No,No,56-65,"$100,001 - $200,000",Excellent. Love programming about women adventurers!,,Exposure,,,,,
530945349,05/09/2024 9:14 PM,Yes,No,No,No,No,No,No,No,No,No,No,No,26-35,"$100,001 - $200,000",,,LasCafeteras,,,,No,No
530962435,05/09/2024 9:59 PM,No,No,No,No,No,No,No,No,Yes,No,Yes,No,66+,"$50,001 - $100,000","Fantastic!  Energy, positive vibes, great entertainers, what a fun night.",,LasCafeteras,,,,No,No
530994741,05/09/2024 11:36 PM,No,No,No,No,No,No,No,Yes,No,No,No,No,56-65,"$50,001 - $100,000",Great all of it was wonderful. Thank you for keeping the arts alive in WW. Especially cultural. ,,LasCafeteras,,,,No,No
531098381,05/10/2024 5:48 AM,No,No,No,No,No,No,No,No,No,No,Yes,No,66+,"$100,001 - $200,000",Outstanding,,LasCafeteras,,,,No,No
531136384,05/10/2024 7:09 AM,No,No,No,No,No,No,No,No,No,No,Yes,No,36-45,"$100,001 - $200,000",The show was AMAZING! Excellent performers. Sound and lighting were solid. It got pretty hot toward the end of the show.,Better fan in the women’s restroom. Someone destroyed it and the smell was overpowering.,LasCafeteras,,,,No,No
531157014,05/10/2024 7:50 AM,No,No,No,No,No,No,No,No,No,No,Yes,No,56-65,"$50,001 - $100,000",Very nice,,LasCafeteras,,,,No,No
531157943,05/10/2024 7:53 AM,No,No,No,No,No,No,No,No,Yes,No,No,No,46-55,"$100,001 - $200,000","The group was fantastic! The lights were not. The sound was fine, but lead male was hard to hear at times. The show was well worth the money. ",,LasCafeteras,,,,No,No
531890213,05/11/2024 11:42 AM,No,No,No,No,No,No,No,No,No,No,Yes,No,66+,"$100,001 - $200,000",It was good & highlighted the singers just right. ,"The Cafeteras are an awesome Band show.  I wish there had been more marketing on their music to the WW, M-F & Tri-Cities region.  I think you would have been completely sold out.  There would have been more of Hispanic turn out even if it was on a Thursday.  I would most definitely go again if they come back to WW.  Thank you so much for bringing them to WW Gesa Power House Theatre...  & for all you do for our WW Region in the ARTS. ",LasCafeteras,,,,No,No
533267551,05/13/2024 7:48 PM,No,No,No,No,No,No,Yes,No,Yes,No,Yes,No,56-65,"$200,001 or above",Beyond wonderful - I'm using a MAC and somehow deleted a nice bit about how wonderful it was.....chat later.,Consider having a few tables and chairs out on the balcony/patio with the door open to allow guests to enjoy the beautiful weather and meet.  I understand that it was too windy for the front yard.,LasCafeteras,,,,No,No
533680496,05/14/2024 3:22 PM,No,No,No,No,No,No,No,No,No,No,Yes,No,66+,"$100,001 - $200,000",Great-haven't seen that much energy on the stage for a long time.,,LasCafeteras,,,,No,No
367456269,03/24/2023 9:24 PM,No,No,,No,,No,No,No,No,No,No,No,66+,,Lighting was subpar. Enjoyed the performance.,,TelAvivWindQuintet,No,,,,
367457380,03/24/2023 9:28 PM,No,No,,No,,No,No,No,Yes,No,No,No,66+,"$100,001 - $200,000",Forgot to attend—couldn’t find the tickets.,,TelAvivWindQuintet,No,,,,
367468313,03/24/2023 10:27 PM,No,No,,No,,No,No,No,Yes,Yes,Yes,No,66+,"$100,001 - $200,000",Excellent,,TelAvivWindQuintet,No,,,,
367469973,03/24/2023 10:37 PM,No,No,,No,,No,No,No,Yes,No,No,No,66+,"$100,001 - $200,000",Terrific,,TelAvivWindQuintet,No,,,,
367586760,03/25/2023 8:26 AM,No,No,,No,,No,No,No,No,Yes,No,No,66+,"$50,001 - $100,000",We enjoyed the very talented musicians very much! Went to both performances. P&Wolf they were SO amazing not only playing together but also acting!! Thank you for bringing them to (America) Walla Walla.,,TelAvivWindQuintet,No,,,,
367639822,03/25/2023 10:32 AM,No,No,,No,,No,No,No,No,No,Yes,No,66+,,All good!  The only suggestion I can make is the stage area can use some sprucing up.,See above comment,TelAvivWindQuintet,No,,,,
367651975,03/25/2023 10:59 AM,No,No,,No,,No,No,No,No,Yes,No,No,66+,"$100,001 - $200,000",Very good. I love the acoustics of the PHT,"I have no suggstions except ""keep up the good work""",TelAvivWindQuintet,No,,,,
367673704,03/25/2023 11:49 AM,No,No,,No,,No,No,No,No,No,Yes,No,66+,"$100,001 - $200,000",Great,,TelAvivWindQuintet,No,,,,
367739190,03/25/2023 2:27 PM,No,No,,Yes,,No,No,No,No,No,Yes,Yes,56-65,"$100,001 - $200,000","The Power House is the perfect venue for a concert like this. All seats are wonderful! Sound: wonderful! Lights: wonderful!
We love coming a bit early to get parking and a glass of wine before the show. It makes the evening extra special. The ushers, greeters and wine servers were all so friendly and helpful!","I would encourage you to maintain the high level of professional, family-friendly, and noncontroversial entertainment selections. Several of your recent/current performers are very offensive.",TelAvivWindQuintet,No,,,,
367912529,03/25/2023 10:45 PM,Yes,No,,No,,No,No,No,No,No,No,No,66+,"$100,001 - $200,000",everything was excellent,,TelAvivWindQuintet,No,,,,
369472606,03/29/2023 9:43 AM,Yes,No,,No,,No,No,No,Yes,No,Yes,No,66+,,Awesome!,,TelAvivWindQuintet,No,,,,
468400313,12/31/2023 9:27 PM,No,No,,No,No,No,No,No,No,No,Yes,No,36-45,,Great!,,AndrewSleighter,,,,,
468404456,12/31/2023 10:00 PM,No,No,,No,No,No,No,No,No,No,Yes,No,25 and under,"$50,000 or below",,,AndrewSleighter,,,,,
468417530,12/31/2023 11:24 PM,No,No,,No,No,No,No,No,No,No,Yes,No,56-65,"$50,000 or below",Excellent,,AndrewSleighter,,,,,
468418627,12/31/2023 11:37 PM,No,No,,No,No,No,No,No,No,No,Yes,No,56-65,"$50,001 - $100,000",Excellent!,Love these shows  at the gesa theater! ,AndrewSleighter,,,,,
468419460,12/31/2023 11:51 PM,No,No,,No,No,No,No,No,No,No,Yes,No,46-55,"$200,001 or above",Phenomenal! We laughed so hard. We also had our three early 20’s children and they were cracking up just as hard! I’m going to find him other places and tell friends. So great!,,AndrewSleighter,,,,,
468421969,01/01/2024 12:21 AM,Yes,No,,No,No,No,No,No,No,No,No,No,66+,"$100,001 - $200,000",4 out of 5.   Wish the closing had been a bit more organized to truly celebrate the turn of the year ,,AndrewSleighter,,,,,
468432356,01/01/2024 2:54 AM,No,No,,No,No,No,No,No,No,Yes,No,No,36-45,"$50,001 - $100,000","It was a good fun event,  sound was great,  lighting was great.  I loved that you added champagne and the East Coast New Years Celebration. ","It was a great show,  great job. 
My only feedback is that the railing right in front of the BB seating was very low and I assume it is for viewing purposes but it was scary walking by that especially for someone scared of heights and also not great with balance. Otherwise it was a great evening.  Thank you! ",AndrewSleighter,,,,,
468445657,01/01/2024 5:17 AM,No,No,,No,No,No,No,Yes,No,No,No,No,66+,"$100,001 - $200,000",Very fun,,AndrewSleighter,,,,,
468468539,01/01/2024 7:26 AM,No,No,,No,No,No,No,Yes,No,No,No,No,56-65,"$100,001 - $200,000",Very nice ,,AndrewSleighter,,,,,
468471479,01/01/2024 7:41 AM,No,No,,No,No,No,No,No,No,No,Yes,No,66+,"$100,001 - $200,000",Excellent ,Great show,AndrewSleighter,,,,,
468475039,01/01/2024 8:00 AM,Yes,No,,No,No,No,No,No,No,No,No,No,56-65,"$50,000 or below",in center of B row it's a bit strange to hear the sound coming from speakers to the side instead of from performer 12 ft. in front of you.,,AndrewSleighter,,,,,
468475133,01/01/2024 7:58 AM,Yes,No,,No,No,No,No,No,No,No,No,No,66+,"$50,001 - $100,000",All good,He was hilarious ! Loved it!,AndrewSleighter,,,,,
468476227,01/01/2024 8:06 AM,No,No,,No,No,No,No,Yes,No,No,No,No,46-55,"$100,001 - $200,000",Great event!  Maybe have the upstairs room open before the show for patrons to have a beverage without blocking the lobby.,,AndrewSleighter,,,,,
468483481,01/01/2024 8:39 AM,No,No,,No,No,No,No,Yes,No,No,No,No,56-65,"$200,001 or above",Staff is very friendly and inviting. The building is very nice. Lighting is adequate.  We had a little difficulty hearing the comedian. Probably because of the soft tone of his voice. ,,AndrewSleighter,,,,,
468527353,01/01/2024 11:43 AM,No,Yes,,No,No,No,No,No,No,No,No,No,66+,"$50,001 - $100,000",Mr. Andrew Sleighter is a comedian that has honed his craft.  He was pretty funny and knows how to get the audience involved.  I would recommend him to others and hope he returns some day soon with a new slate of comedic originals.  Thanks for giving him a stage to stand on and to send us into 2024 on a positive note.,"As the Powerhouse Theater becomes more popular and makes enough money for improvements, please consider making changes to the facility.  I think it could be a better venue over time if more funds would be spent to enhance the interior, but not take away from the historic nature of the building.  Thanks.",AndrewSleighter,,,,,
468539658,01/01/2024 12:35 PM,No,No,,No,No,No,No,No,No,No,Yes,No,36-45,"$100,001 - $200,000","We thought the event was great! Sound and lighting were great, the comic was very enjoyable, and the tickets were reasonably priced. I thought the champagne toast was a very nice thought, but wasn't executed very well. ","This was our first time to the theater, and we really enjoyed the event! I realize that there may be very little that can be done about this, but my main comment for things to improve would be the congestion of the lobby before the show. I realize there are several things that need to take place (will call, ticket scanning, coat check, bar, etc.) in a relatively small space, but the crowding means people have to wait outside for a while so that they can squeeze between people to get through the lobby. Perhaps longer hours for the bar, moving will call, or something like that would be helpful for reducing congestion. That said, the staff were all very friendly, welcoming, and helpful!",AndrewSleighter,,,,,
468556858,01/01/2024 4:31 PM,No,No,,No,No,No,No,No,No,No,No,Yes,36-45,"$100,001 - $200,000","Very well done. Fun atmosphere in a beautiful theater, everyone friendly, comedian very funny",,AndrewSleighter,,,,,
468564484,01/01/2024 2:10 PM,No,No,,No,No,No,No,No,No,No,Yes,No,56-65,"$200,001 or above","Excellent event! We never stopped laughing for almost 2 hours. The seats were comfortable and the staff were welcoming.  Thankfully, intermission was long enough to get everyone through the bathrooms. ",,AndrewSleighter,,,,,
468585485,01/01/2024 3:33 PM,Yes,No,,No,No,No,No,No,No,No,Yes,No,56-65,"$200,001 or above",Great night!,,AndrewSleighter,,,,,
468693138,01/02/2024 12:56 AM,Yes,No,,No,No,No,No,No,No,No,No,No,66+,,Excellent performer,,AndrewSleighter,,,,,
468800848,01/02/2024 9:47 AM,No,No,,No,No,No,No,No,No,No,Yes,No,36-45,"$50,001 - $100,000",Ticket prices were high for what it was...a good show but I had heard a good amount of the material previously on his posted videos...would have been nice to have more new material--especially for the new year-since it was advertised as a NYE special...was expecting new material not a lot of repeated/old jokes...,"Having a military/veteran discount available would be nice. Also, consistency in pricing on the website from the main page throughout the event pages...Many times it differs and is conflicting...ticket pricing info should be clear and concise at a minimum, especially at the prices being charged. These aren't discount/cheap tickets. Another little detail--When popcorn is served in the lobby - Make it fresh...Nothing says ""We got you good"" like paying $4 for a tiny bag of popcorn...only to find out it is STALE. That's just bad business and acting in bad faith",AndrewSleighter,,,,,
468923360,01/02/2024 3:48 PM,No,No,,No,No,No,No,No,Yes,No,Yes,No,56-65,"$50,001 - $100,000","  Andrew's voice was a little hard to distinguish at times, not sure if it was the mic or that he talked fairly fast. All in all it was allot of fun. 
We look foreword to next years New Years eve show, we have been at most of the New Years shows since the theatre started, they've all been enjoyable. 
  Thank You very much. Darrin and Lori.",,AndrewSleighter,,,,,
445624931,10/27/2023 9:14 PM,No,No,,No,No,No,No,No,Yes,No,No,No,66+,"$100,001 - $200,000","Perfect. This was great, so much fun. Bring them back please",,CollisionofRhythm,,,,,
445625593,10/27/2023 9:16 PM,No,No,,No,No,No,No,No,Yes,No,No,No,66+,"$50,001 - $100,000",Excellent ,,CollisionofRhythm,,,,,
445626407,10/27/2023 9:21 PM,No,No,,No,No,No,No,No,Yes,No,No,No,66+,"$100,001 - $200,000","Seemed great to me. Lighting, sound and content were great.
A great night’s entertainment. Fun evening.",,CollisionofRhythm,,,,,
445626526,10/27/2023 9:24 PM,No,No,,No,No,No,No,No,No,No,Yes,No,66+,"$50,000 or below","Amazing, actually. These two performers were lighted and miked beautifully. The value of ticket price to performance was startling, as the cost seemed low for the very high quality of performance (not a complaint at all, and our tickets were actually paid from a gift certificate). We left feeling upbeat and totally satisfied, not only with the performance but with the theatre experience. The people who work the events are always great!",,CollisionofRhythm,,,,,
445626883,10/27/2023 9:25 PM,No,No,,No,No,No,No,No,Yes,No,No,No,66+,"$50,001 - $100,000",All around good! Interesting and different twist on music. Affordable tickets which is important for families and those on fixed income,,CollisionofRhythm,,,,,
445639998,10/27/2023 10:34 PM,Yes,No,,No,No,No,No,No,No,No,Yes,No,56-65,"$100,001 - $200,000","All was good. Very lively, very entertaining ",,CollisionofRhythm,,,,,
445642607,10/27/2023 10:52 PM,Yes,No,,No,No,No,No,No,No,No,No,No,66+,,Best event for me so far.  All good!,,CollisionofRhythm,,,,,
445652294,10/28/2023 12:39 AM,Yes,No,,No,No,No,No,No,No,No,No,No,56-65,"$100,001 - $200,000","Absolutely amazing.
The only thing that bothered us was the couple seated in front of us, we had G-9 and G- 10 seats. At intermission, the man, I certainly wouldn’t call him a gentleman, came us to us. I had complimented his female friend about her attire. He then said , my friend and I were too “chatty “ and could we not whisper or comment on the performance as it was distracting for him. We sat through the rest of the show in silence, while the audience continued to enjoy the wonderful display of talent we had mutually payed for. We were not by any means, outspoken or overbearing with making soft comments about  the amazing performance we were witnessing. I thank everyone that gives Walla Walla these amazing performances.","Excellent staff, volunteers.",CollisionofRhythm,,,,,
445709301,10/28/2023 7:30 AM,No,No,,No,No,No,No,No,No,No,No,Yes,56-65,"$50,001 - $100,000",Everything seemed perfect! Very comfortable. ,,CollisionofRhythm,,,,,
445733845,10/28/2023 9:08 AM,Yes,No,,No,No,No,No,No,Yes,No,No,No,66+,,Excellent!,,CollisionofRhythm,,,,,
445740989,10/28/2023 9:36 AM,No,No,,No,No,No,No,Yes,No,No,No,No,66+,"$100,001 - $200,000",Good,Staff was helpful and tentative. Performers were very entertaining and professional.,CollisionofRhythm,,,,,
446534618,10/30/2023 8:05 PM,No,No,,No,No,No,No,No,Yes,No,No,No,66+,"$50,001 - $100,000","very entertaining and also educational. most professional setting, with great sound and lighting, Enjoyed myself greatly.",,CollisionofRhythm,,,,,
449155485,11/07/2023 3:53 PM,Yes,No,,No,No,No,No,No,Yes,No,No,No,66+,,"The person who manned the spotlight did an exceptional job of keeping up with all the rapid changes.  The sound was clear and at an appropriate volume making it a pleasant experience and bringing out the characteristics of each instrument:  marimba (xylophone), standard flute, Native American flute (one of my favorites; so haunting), saxophone(s), piano, standard (stick) drumming, long djembe(?) hand drumming along with extras like juggling, tap dancing, beat boxing and singing.  Very well done!","The members of Collision of Rhythm were two extremely talented guys whose desire is clearly to teach and create a community-based experience.  Their enthusiasm shined on us all, and the audience participation was absolutely essential to a successful performance.  ""We...we are made of music!""  To have a venue of inclusivity for younger and older generations alike is welcome.  The fast-moving tempo of the show kept it captivating.  Would love to see them return to the Gesa Powerhouse Theatre.  More power!",CollisionofRhythm,,,,,
362121696,03/13/2023 11:47 AM,No,No,,No,,No,No,Yes,Yes,No,Yes,No,66+,,"good quality, lighting fair, good value for family friendly.",,LeapinLouie,No,,,,
495229981,03/05/2024 10:54 PM,No,No,No,No,No,No,No,No,No,No,Yes,No,66+,"$50,001 - $100,000",Reasonable price for concessions & admission. We were in very back row of balcony. I felt a little claustrophobic. The rows were so narrow that we had to practically step on the other people to get to our seats. The wire-type barrier in the front row of the balcony did not feel safe. I also can’t figure out how we would have all gotten out safely if there was a fire. I would rather pay more and have more room to move about. ,My four year old grandson just loved the bubble show. I wish the theater would offer more than one showing (maybe 2:00 and 4:30) so more of his friends could have watched to show too.,BubbleBonanza,,,,,
495288116,03/06/2024 5:30 AM,No,No,No,No,No,No,No,No,No,No,No,Yes,36-45,"$50,000 or below",My son absolutely loved it as did I and my spouse,"So far, we have loved every family event that we have been too",BubbleBonanza,,,,,
495353479,03/06/2024 8:33 AM,No,No,No,No,No,No,No,Yes,No,No,No,No,36-45,"$50,001 - $100,000",,,BubbleBonanza,,,,,
495357673,03/06/2024 8:46 AM,No,No,No,No,No,No,No,Yes,No,No,No,No,56-65,"$200,001 or above","The kids we brought enjoyed it.  For the price I was satisfied.  I thought the presentation, sound and especially the stage design pretty mediocre.  I think Jeff could benefit from stepping up the design elements a bit.  I appreciated reasonably-priced concessions, because of course the kids wanted popcorn!  Overall I appreciate having alternative kid-friendly programs and activities.  ",,BubbleBonanza,,,,,
495405724,03/06/2024 10:30 AM,No,No,No,No,No,No,No,Yes,No,No,No,No,,"$50,001 - $100,000",Fun! Reasonable value.,,BubbleBonanza,,,,,
495495288,03/06/2024 2:07 PM,Yes,No,No,No,No,No,Yes,Yes,Yes,Yes,Yes,No,66+,"$100,001 - $200,000","Absolutely fantastic. Daughter (30s), 2 grands (6&7) we’re all over it!The programming for mixed age, families is fun and helpful to train “concert “ behavior/manners..",,BubbleBonanza,,,,,
498970205,03/14/2024 2:10 PM,No,No,No,No,No,No,No,No,Yes,No,Yes,No,26-35,"$50,000 or below",The kids loved the bubbles and being able to participate in the show!,I am always happy when I visit! Thank you so much for all the opportunities Gesa Power House provides. ,BubbleBonanza,,,,,
383547622,04/29/2023 10:05 PM,No,No,,No,,No,No,No,Yes,No,No,No,66+,"$50,001 - $100,000",This was a wonderful experience! The music and the fiddlers themselves made for a great evening. The ticket price was surprisingly low for the quality of the show. We love the Gesa Powerhouse Theater!,,NordicFiddlersBloc,No,,,,
